results/community/community_network_metrics/community_parameters_size_ge_15.csv

community_id,size,degree,weighted_degree,clustering_coefficient,density
Community_5,359,0,0.0,0.0,0.9998755076951806
Community_13,18,0,0.0,0.0,0.7908496732026143
Community_20,22,0,0.0,0.0,0.7922077922077922
Community_21,82,0,0.0,0.0,0.7777777777777778
Community_22,83,1,12.990404040404039,0.0,0.9130179253599765
Community_54,22,0,0.0,0.0,0.7445887445887446
Community_78,32,1,12.990404040404039,0.0,0.905241935483871
Community_81,20,0,0.0,0.0,1.0
Community_97,19,0,0.0,0.0,0.7543859649122807
Community_135,16,0,0.0,0.0,0.425
Community_188,72,0,0.0,0.0,0.323943661971831
Community_192,39,0,0.0,0.0,0.6005398110661269
Community_203,23,0,0.0,0.0,0.48221343873517786

notes/report.md

### Density

Dai dati riportati si osserva che comunità medio-grandi, presentano valori di densità variabile. Analizzando le comunità  con size compresa tra 39 e 83 si osservano densità molto diverse. Ovvero comprese tra 0.324 e 0.913. 
Le cause di questo comportamento possono essere sia matematiche che biologiche.

Per le comunità di dimensione più contenuta (size compresa tra 10 e 32), si osserva in generale una densità elevata, con la maggior parte dei valori compresa tra ~0.7 e ~1.0. Sono tuttavia presenti alcune eccezioni con densità più moderata o bassa, come Community_135 (0.425), Community_203 (0.482) e Community_100 (0.346).

### Clustering coefficient

community_id   size  density  clustering_coefficient
Community_5    359   1.000    0.903
Community_13   18    0.791    0.746
Community_20   22    0.792    0.593
Community_21   82    0.778    0.631
Community_22   83    0.913    0.851
Community_53   10    0.733    0.660
Community_54   22    0.745    0.574
Community_58   11    1.000    0.831
Community_59   10    0.889    0.629
Community_78   32    0.905    0.653
Community_81   20    1.000    0.964
Community_97   19    0.754    0.553
Community_100  13    0.346    0.442
Community_109  13    1.000    0.787
Community_127  14    0.604    0.671
Community_135  16    0.425    0.596
Community_187  10    1.000    0.660
Community_188  72    0.324    0.616
Community_192  39    0.601    0.706
Community_203  23    0.482    0.513

## Weighted degree

Solo le comunità 23 e 78 risultano essere connesse tra di loro con un $\text{weighted degree} = 12.99$.